{
  "schema_version": "damage_curve_artifact_index.v2",
  "portable_package_baseline": "library v2.5",
  "repository_contract_revision": "2026-10-25.warehouse-flood-screening-v1",
  "polling_contract": {
    "strategy": "poll_index_then_compare_cell_pin_and_sha256",
    "consumer_pin_fields": [
      "cell_id",
      "semantic_damage_model_version",
      "documentation_revision",
      "artifact_schema_version",
      "sha256"
    ]
  },
  "artifacts": [
    {
      "cell_id": "hail_solar",
      "damage_code_id": "HAIL_SOLAR_PV_MODULE_V1",
      "semantic_damage_model_version": "model v1.0",
      "documentation_revision": "docs r7",
      "consumer_pin": "hail_solar@model_v1_0__docs_r7",
      "artifact_schema_version": "damage_curve_record_bundle.v2",
      "capability_schema_version": "capability_declaration.v2",
      "publication_status": "repository_canonical_not_in_portable_package",
      "path": "docs/cells/hail_solar/current/hail_solar__model_v1_0__docs_r7__curve_artifact.json",
      "sha256": "8c52f3442eb606f55aa0502fbb2738df70076f8a181de463c029061020b3cf32",
      "changelog_path": "docs/cells/hail_solar/CHANGELOG.json",
      "known_answer_tests_path": "docs/cells/hail_solar/current/known_answer_tests_hail_solar__model_v1_0__docs_r7.json"
    },
    {
      "cell_id": "flood_solar",
      "damage_code_id": "FLOOD_SOLAR_ELECTRICAL_INUNDATION_V1",
      "semantic_damage_model_version": "model v1.0",
      "documentation_revision": "docs r4",
      "consumer_pin": "flood_solar@model_v1_0__docs_r4",
      "artifact_schema_version": "damage_curve_record_bundle.v2",
      "capability_schema_version": "capability_declaration.v2",
      "publication_status": "repository_canonical_not_in_portable_package",
      "path": "docs/cells/flood_solar/current/flood_solar__model_v1_0__docs_r4__curve_artifact.json",
      "sha256": "a08e77ef034e1ecea3e7cd05d13c825921b54d610fca9de8651ebda8e857082d",
      "changelog_path": "docs/cells/flood_solar/CHANGELOG.json"
    },
    {
      "cell_id": "wind_tornado_wind",
      "damage_code_id": "WIND_TORNADO_WIND_V1",
      "semantic_damage_model_version": "model v1.0",
      "documentation_revision": "docs r4",
      "consumer_pin": "wind_tornado_wind@model_v1_0__docs_r4",
      "artifact_schema_version": "damage_curve_record_bundle.v2",
      "capability_schema_version": "capability_declaration.v2",
      "publication_status": "repository_canonical_not_in_portable_package",
      "path": "docs/cells/wind_tornado_wind/current/wind_tornado_wind__model_v1_0__docs_r4__curve_artifact.json",
      "sha256": "908f386953d062a62a33b6714020374b9b9d8a4538006e80d37047686c2c127a",
      "changelog_path": "docs/cells/wind_tornado_wind/CHANGELOG.json"
    },
    {
      "cell_id": "strong_wind_solar",
      "damage_code_id": "STRONG_WIND_SOLAR_V1",
      "semantic_damage_model_version": "model v1.0",
      "documentation_revision": "docs r3",
      "consumer_pin": "strong_wind_solar@model_v1_0__docs_r3",
      "artifact_schema_version": "damage_curve_record_bundle.v2",
      "capability_schema_version": "capability_declaration.v2",
      "publication_status": "repository_canonical_not_in_portable_package",
      "path": "docs/cells/strong_wind_solar/current/strong_wind_solar__model_v1_0__docs_r3__curve_artifact.json",
      "sha256": "832f47d69372ec54723a61b8a956addccef07bb39338c3ec99907e116f1855ca",
      "changelog_path": "docs/cells/strong_wind_solar/CHANGELOG.json"
    },
    {
      "cell_id": "wildfire_solar",
      "damage_code_id": "WILDFIRE_SOLAR_FSIM_SCREENING_V1",
      "semantic_damage_model_version": "model v1.0",
      "documentation_revision": "docs r3",
      "consumer_pin": "wildfire_solar@model_v1_0__docs_r3",
      "artifact_schema_version": "damage_curve_record_bundle.v2",
      "capability_schema_version": "capability_declaration.v2",
      "publication_status": "repository_canonical_not_in_portable_package",
      "path": "docs/cells/wildfire_solar/current/wildfire_solar__model_v1_0__docs_r3__curve_artifact.json",
      "sha256": "598512fbe2f0a3c8db48df69fdb2cd00ca5e0cc8e7ef761555837a3d76d166d8",
      "changelog_path": "docs/cells/wildfire_solar/CHANGELOG.json",
      "known_answer_tests_path": "docs/cells/wildfire_solar/current/known_answer_tests_wildfire_solar__model_v1_0__docs_r3.json"
    },
    {
      "cell_id": "flood_wind",
      "damage_code_id": "FLOOD_WIND_FEMA_HAZUS_SUBSTATION_SCREENING_V1",
      "semantic_damage_model_version": "model v1.0",
      "documentation_revision": "docs r1",
      "consumer_pin": "flood_wind@model_v1_0__docs_r1",
      "artifact_schema_version": "damage_curve_record_bundle.v3",
      "capability_schema_version": "capability_declaration.v3",
      "publication_status": "repository_canonical_not_in_portable_package",
      "path": "docs/cells/flood_wind/current/flood_wind__model_v1_0__docs_r1__curve_artifact.json",
      "sha256": "37da745d87a4722e13118319bd30d9d2bcfd18dabc2a198ac6b8b1422bc3e1c1",
      "changelog_path": "docs/cells/flood_wind/CHANGELOG.json",
      "known_answer_tests_path": "docs/cells/flood_wind/current/known_answer_tests_flood_wind__model_v1_0__docs_r1.json"
    },
    {
      "cell_id": "wildfire_wind",
      "damage_code_id": "WILDFIRE_WIND_PARTIAL_ELECTRICAL_SCREENING_V1",
      "semantic_damage_model_version": "model v1.0",
      "documentation_revision": "docs r1",
      "consumer_pin": "wildfire_wind@model_v1_0__docs_r1",
      "artifact_schema_version": "damage_curve_record_bundle.v3",
      "capability_schema_version": "capability_declaration.v3",
      "publication_status": "repository_canonical_not_in_portable_package",
      "path": "docs/cells/wildfire_wind/current/wildfire_wind__model_v1_0__docs_r1__curve_artifact.json",
      "sha256": "3f923f506a2082dd2f074c8b3cc3d696288097072eb8b6f803f3eb7d3f2b4e0d",
      "changelog_path": "docs/cells/wildfire_wind/CHANGELOG.json",
      "known_answer_tests_path": "docs/cells/wildfire_wind/current/known_answer_tests_wildfire_wind__model_v1_0__docs_r1.json"
    },
    {
      "cell_id": "tropical_cyclone_wind_wind",
      "damage_code_id": "TROPICAL_CYCLONE_WIND_WIND_JAIMES_TOWER_SCREENING_V1_2",
      "semantic_damage_model_version": "model v1.2",
      "documentation_revision": "docs r2",
      "consumer_pin": "tropical_cyclone_wind_wind@model_v1_2__docs_r2",
      "artifact_schema_version": "damage_curve_record_bundle.v3",
      "capability_schema_version": "capability_declaration.v3",
      "publication_status": "repository_canonical_not_in_portable_package",
      "path": "docs/cells/tropical_cyclone_wind_wind/current/tropical_cyclone_wind_wind__model_v1_2__docs_r2__curve_artifact.json",
      "sha256": "009996c07eb8150f79f11741d42b6cd37562d655ee336f82f178ccdeb987c992",
      "changelog_path": "docs/cells/tropical_cyclone_wind_wind/CHANGELOG.json",
      "known_answer_tests_path": "docs/cells/tropical_cyclone_wind_wind/current/known_answer_tests_tropical_cyclone_wind_wind__model_v1_2__docs_r2.json"
    },
    {
      "cell_id": "tropical_cyclone_wind_solar",
      "damage_code_id": "TROPICAL_CYCLONE_WIND_SOLAR_SCREENING_COMPLETE_V2_1",
      "semantic_damage_model_version": "model v2.1",
      "documentation_revision": "docs r2",
      "consumer_pin": "tropical_cyclone_wind_solar@model_v2_1__docs_r2",
      "artifact_schema_version": "damage_curve_record_bundle.v3",
      "capability_schema_version": "capability_declaration.v3",
      "publication_status": "repository_canonical_not_in_portable_package",
      "path": "docs/cells/tropical_cyclone_wind_solar/current/tropical_cyclone_wind_solar__model_v2_1__docs_r2__curve_artifact.json",
      "sha256": "2fbc34fbf8f91df408fe1b3c8d01d260d013119cbcba594b6a9a60044cd2113e",
      "changelog_path": "docs/cells/tropical_cyclone_wind_solar/CHANGELOG.json",
      "known_answer_tests_path": "docs/cells/tropical_cyclone_wind_solar/current/known_answer_tests_tropical_cyclone_wind_solar__model_v2_1__docs_r2.json"
    },
    {
      "cell_id": "flood_substation",
      "damage_code_id": "FLOOD_SUBSTATION_DEPTH_SCREENING_V1",
      "semantic_damage_model_version": "model v1.0",
      "documentation_revision": "docs r1",
      "consumer_pin": "flood_substation@model_v1_0__docs_r1",
      "artifact_schema_version": "damage_curve_record_bundle.v3",
      "capability_schema_version": "capability_declaration.v3",
      "publication_status": "repository_canonical_not_in_portable_package",
      "path": "docs/cells/flood_substation/current/flood_substation__model_v1_0__docs_r1__curve_artifact.json",
      "sha256": "f001eb0191439a1345a7a794995c684ef731f777c4b3e1eff0298de592999f30",
      "changelog_path": "docs/cells/flood_substation/CHANGELOG.json",
      "known_answer_tests_path": "docs/cells/flood_substation/current/known_answers.json"
    },
    {
      "cell_id": "flood_bess",
      "damage_code_id": "BESS_FLOOD_INUNDATION_SCREENING_V1",
      "semantic_damage_model_version": "model v1.0",
      "documentation_revision": "docs r1",
      "consumer_pin": "flood_bess@model_v1_0__docs_r1",
      "artifact_schema_version": "damage_curve_record_bundle.v2",
      "capability_schema_version": "capability_declaration.v2",
      "publication_status": "repository_canonical_not_in_portable_package",
      "path": "docs/cells/flood_bess/current/curve_artifact.json",
      "sha256": "c9bc9194accb3adbc2c05a9720b4945dd5a969bd7288eb600d5e901aa0185d24",
      "changelog_path": "docs/cells/flood_bess/CHANGELOG.json",
      "known_answer_tests_path": "docs/cells/flood_bess/current/known_answers.json"
    },
    {
      "cell_id": "tropical_cyclone_wind_bess",
      "damage_code_id": "BESS_TC_WIND_SCREENING_V1",
      "semantic_damage_model_version": "model v1.0",
      "documentation_revision": "docs r1",
      "consumer_pin": "tropical_cyclone_wind_bess@model_v1_0__docs_r1",
      "artifact_schema_version": "damage_curve_record_bundle.v3",
      "capability_schema_version": "capability_declaration.v3",